index,name,race/url,race/name,desc,ability_bonuses/0/name,ability_bonuses/0/url,ability_bonuses/0/bonus,racial_traits/0/url,racial_traits/0/name,url,starting_proficiencies/0/url,starting_proficiencies/0/name,starting_proficiencies/1/url,starting_proficiencies/1/name,starting_proficiencies/2/url,starting_proficiencies/2/name,starting_proficiencies/3/url,starting_proficiencies/3/name,language_options/choose,language_options/from/0/url,language_options/from/0/name,language_options/from/1/url,language_options/from/1/name,language_options/from/2/url,language_options/from/2/name,language_options/from/3/url,language_options/from/3/name,language_options/from/4/url,language_options/from/4/name,language_options/from/5/url,language_options/from/5/name,language_options/from/6/url,language_options/from/6/name,language_options/from/7/url,language_options/from/7/name,language_options/from/8/url,language_options/from/8/name,language_options/from/9/url,language_options/from/9/name,language_options/from/10/url,language_options/from/10/name,language_options/from/11/url,language_options/from/11/name,language_options/from/12/url,language_options/from/12/name,language_options/from/13/url,language_options/from/13/name,language_options/type,racial_trait_options/choose,racial_trait_options/from/0/url,racial_trait_options/from/0/name,racial_trait_options/from/1/url,racial_trait_options/from/1/name,racial_trait_options/from/2/url,racial_trait_options/from/2/name,racial_trait_options/from/3/url,racial_trait_options/from/3/name,racial_trait_options/from/4/url,racial_trait_options/from/4/name,racial_trait_options/from/5/url,racial_trait_options/from/5/name,racial_trait_options/from/6/url,racial_trait_options/from/6/name,racial_trait_options/from/7/url,racial_trait_options/from/7/name,racial_trait_options/from/8/url,racial_trait_options/from/8/name,racial_trait_options/from/9/url,racial_trait_options/from/9/name,racial_trait_options/from/10/url,racial_trait_options/from/10/name,racial_trait_options/from/11/url,racial_trait_options/from/11/name,racial_trait_options/type,racial_traits/1/url,racial_traits/1/name,racial_traits/2/url,racial_traits/2/name,ability_bonuses/0,ability_bonuses/1,ability_bonuses/2,ability_bonuses/3,ability_bonuses/4,ability_bonuses/5,languages/0/url,languages/0/name,languages/1/url,languages/1/name,racial_traits/3/name,racial_traits/3/url
1,Hill Dwarf,http://www.dnd5eapi.co/api/races/1,Dwarf,"As a hill dwarf, you have keen senses, deep intuition, and remarkable resilience.",WIS,http://www.dnd5eapi.co/api/ability-scores/5,1,http://www.dnd5eapi.co/api/traits/4,Dwarven Toughness,http://www.dnd5eapi.co/api/subraces/1,,,,,,,,,,,,,,,,,,,,,,,,,,,,,,,,,,,,,,,,,,,,,,,,,,,,,,,,,,,,,,,,,,,,,,,,,,,,,,,,
2,High Elf,http://www.dnd5eapi.co/api/races/2,Elf,"As a high elf, you have a keen mind and a mastery of at least the basics of magic. In many fantasy gaming worlds, there are two kinds of high elves. One type is haughty and reclusive, believing themselves to be superior to non-elves and even other elves. The other type is more common and more friendly, and often encountered among humans and other races.",INT,http://www.dnd5eapi.co/api/ability-scores/4,1,,,http://www.dnd5eapi.co/api/subraces/2,http://www.dnd5eapi.co/api/proficiencies/42,Longswords,http://www.dnd5eapi.co/api/proficiencies/48,Shortswords,http://www.dnd5eapi.co/api/proficiencies/33,Shortbows,http://www.dnd5eapi.co/api/proficiencies/56,Longbows,1,http://www.dnd5eapi.co/api/languages/2,Dwarvish,http://www.dnd5eapi.co/api/languages/4,Giant,http://www.dnd5eapi.co/api/languages/5,Gnomish,http://www.dnd5eapi.co/api/languages/6,Goblin,http://www.dnd5eapi.co/api/languages/7,Halfling,http://www.dnd5eapi.co/api/languages/8,Orc,http://www.dnd5eapi.co/api/languages/9,Abyssal,http://www.dnd5eapi.co/api/languages/10,Celestial,http://www.dnd5eapi.co/api/languages/11,Draconic,http://www.dnd5eapi.co/api/languages/12,Deep Speech,http://www.dnd5eapi.co/api/languages/13,Infernal,http://www.dnd5eapi.co/api/languages/14,Primordial,http://www.dnd5eapi.co/api/languages/15,Sylvan,http://www.dnd5eapi.co/api/languages/16,Undercommon,language,1,http://www.dnd5eapi.co/api/traits/10,High Elf Cantrip: Light,http://www.dnd5eapi.co/api/traits/10,High Elf Cantrip: Mage Hand,http://www.dnd5eapi.co/api/traits/10,High Elf Cantrip: Mending,http://www.dnd5eapi.co/api/traits/10,High Elf Cantrip: Message,http://www.dnd5eapi.co/api/traits/10,High Elf Cantrip: Minor Illusion,http://www.dnd5eapi.co/api/traits/10,High Elf Cantrip: Acid Splash,http://www.dnd5eapi.co/api/traits/10,High Elf Cantrip: Prestidigitation,http://www.dnd5eapi.co/api/traits/10,High Elf Cantrip: Ray of Frost,http://www.dnd5eapi.co/api/traits/10,High Elf Cantrip: Shocking Grasp,http://www.dnd5eapi.co/api/traits/10,High Elf Cantrip: True Strike,http://www.dnd5eapi.co/api/traits/10,High Elf Cantrip: Chill Touch,http://www.dnd5eapi.co/api/traits/10,High Elf Cantrip: Dancing Lights,trait,,,,,,,,,,,,,,,,
3,Lightfoot Halfling,http://www.dnd5eapi.co/api/races/3,Halfling,"As a lightfoot halfling, you can easily hide from notice, even using other people as cover. You're inclined to be affable and get along well with others. Lightfoots are more prone to wanderlust than other halflings, and often dwell alongside other races or take up a nomadic life.",CHA,http://www.dnd5eapi.co/api/ability-scores/6,1,http://www.dnd5eapi.co/api/traits/23,Naturally Stealthy,http://www.dnd5eapi.co/api/subraces/3,,,,,,,,,,,,,,,,,,,,,,,,,,,,,,,,,,,,,,,,,,,,,,,,,,,,,,,,,,,,,,,,,,,,,,,,,,,,,,,,
4,Mountain Dwarf,http://www.dnd5eapi.co/api/races/1,Dwarf,"As a mountain dwarf, you're strong and hardy, accustomed to a difficult life in rugged terrain. You're probably on the tall side (for a dwarf), and tend toward lighter coloration.",STR,http://www.dnd5eapi.co/api/ability-scores/1,2,,,http://www.dnd5eapi.co/api/subraces/4,http://www.dnd5eapi.co/api/proficiencies/2,Medium armor,http://www.dnd5eapi.co/api/proficiencies/3,Heavy armor,,,,,,,,,,,,,,,,,,,,,,,,,,,,,,,,,,,,,,,,,,,,,,,,,,,,,,,,,,,,,,,,,,,,,,,,,,,,
5,Wood Elf,http://www.dnd5eapi.co/api/races/2,Elf,"As a wood elf, you have keen senses and intuition, and your fleet feet carry you quickly through your native forests.",WIS,http://www.dnd5eapi.co/api/ability-scores/5,1,http://www.dnd5eapi.co/api/traits/37,Fleet of Foot,http://www.dnd5eapi.co/api/subraces/5,http://www.dnd5eapi.co/api/proficiencies/42,Longswords,http://www.dnd5eapi.co/api/proficiencies/48,Shortswords,http://www.dnd5eapi.co/api/proficiencies/33,Shortbows,http://www.dnd5eapi.co/api/proficiencies/56,Longbows,,,,,,,,,,,,,,,,,,,,,,,,,,,,,,,,,,,,,,,,,,,,,,,,,,,,,,,,,http://www.dnd5eapi.co/api/traits/38,Mask of the Wild,,,,,,,,,,,,,,
6,Dark Elf (Drow),http://www.dnd5eapi.co/api/races/2,Elf,"As a wood elf, you have keen senses and intuition, and your fleet feet carry you quickly through your native forests.",CHA,http://www.dnd5eapi.co/api/ability-scores/6,1,http://www.dnd5eapi.co/api/traits/39,Superior Darkvision,http://www.dnd5eapi.co/api/subraces/6,http://www.dnd5eapi.co/api/proficiencies/46,Rapiers,http://www.dnd5eapi.co/api/proficiencies/48,Shortswords,http://www.dnd5eapi.co/api/proficiencies/54,"Crossbows, hand",,,,,,,,,,,,,,,,,,,,,,,,,,,,,,,,,,,,,,,,,,,,,,,,,,,,,,,,,,,http://www.dnd5eapi.co/api/traits/40,Sunlight Sensitivity,http://www.dnd5eapi.co/api/traits/41,Drow Magic,,,,,,,,,,,,
7,Rock Gnome,http://www.dnd5eapi.co/api/races/6,Gnome,"As a rock gnome, you have a natural inventiveness and hardiness beyond that of other gnomes.",,,,http://www.dnd5eapi.co/api/traits/1,Darkvision,http://www.dnd5eapi.co/api/subraces/7,,,,,,,,,,,,,,,,,,,,,,,,,,,,,,,,,,,,,,,,,,,,,,,,,,,,,,,,,,,,,,,,,http://www.dnd5eapi.co/api/traits/19,Gnome Cunning,http://www.dnd5eapi.co/api/traits/20,Artificer's Lore,0,0,1,0,0,0,http://www.dnd5eapi.co/api/languages/1,Common,http://www.dnd5eapi.co/api/languages/5,Gnomish,Tinker,http://www.dnd5eapi.co/api/traits/21
